id,bid,user_id,用户昵称,微博正文,头条文章url,发布位置,艾特用户,话题,转发数,评论数,点赞数,发布时间,发布工具,微博图片url,微博视频url,retweet_id
4823173184622096,M9IQ6jopW,5661972210,karsonkaye,小区没有确诊也没有密接，灵岛来一圈过后直接铁皮焊死，庆幸前天出去玩了，不然得嚯嚯鳖死在小区,,,,,0,18,2,2022-10-10 23:59,小米11,"['https://wx4.sinaimg.cn/large/006bb3Cqgy1h70muic6hej33hc3hcb2e.jpg', 'https://wx3.sinaimg.cn/large/006bb3Cqgy1h70mvvdadwj30k00k0whj.jpg']",,
4823173072422158,M9IPVaa74,6114860795,瓜瓜quack,看着微信小道消息聊天记录乱飞而学院领导一片静默看着越来越紧的政策和一片安详的确诊数字我觉得我的世界可以在任何一秒迅速崩塌,,,,,1,6,1,2022-10-10 23:58,OPPO Reno6 5G,,,
4823172631757266,M9IPd7n90,6974460248,·夏日筏纭·,#湘潭疫情#湘潭你是真的没钱了几个确诊了步步高还给我开业你是不逼着全湘潭都阳了还复课复课复读物学生全都变阳好吗,,,,湘潭疫情,1,10,68,2022-10-10 23:57,iPhone客户端,,,
4823172614980761,M9IPbkTIR,5494321383,上岸既遂xu,6一个县半天确诊比之前几年加起来还多154个'很多可怕幸好我没回家pyq全是被隔离的,,,,,0,0,0,2022-10-10 23:57,nova7SE 5G你在焦点在,,,
4823171423800110,M9INgfWA6,5848430321,小兰兰记事簿,#泸州疫情#我不太理解了，9号爆发的疫情，新增154个，只有4个有社会活动轨迹，意思那150个之前一个周都没出门过，看样子是居家隔离的，那源头是个啥子情况哦，意思早就有确诊了，然后把和他有接触的早就全部隔离了吗,,,,泸州疫情,0,10,20,2022-10-10 23:52,K30 至尊纪念版,,,
4823170475360384,M9ILJmutO,3001010294,诅咒自己die,#你有超过七年以上的友情吗#去年5月份散了刚好第七年多么巧合啊5月以后我就确诊抑郁直到现在一个人在这段漫长而煎熬的时光里苦苦挣扎但这一切你都不曾知晓,,,,你有超过七年以上的友情吗,0,1,1,2022-10-10 23:48,iQOO Neo3 生而为赢,,,
4823170463567787,M9ILIeY8X,5032698371,CovLall,因为一场路演活动附近区域至少封10天像我们离得稍远的也跟着至少三天临界区域安上铁板公共交通工具不停站一天一户一人领表出门只有20年我们才这么恼火过最近的一个确诊在我们小区对面那天因为码变色出去做核酸街上偶尔一个人黄色法拉利一路直刹根本没几个车公交车沿着机电城停了一坡看惯了平时的热热闹闹现在想起来还是有点小唏嘘其实在想要是我知道有这场活动是不是也会去凑热闹所以真的很恨yq让本来合法合适的社会活动变成人们埋怨个体的理由…,,,,,0,4,1,2022-10-10 23:48,荣耀30 5G,,,
4823170445739983,M9ILGo5en,3605315293,延安中院,【#医生下班路上多看一眼救下一条命#】近日，湖南长沙，医生屈雅娴下班坐公交回家时，发现前排一老人突然站起来跺脚。不一会儿，老人准备下车，但走路有些不稳。出于职业敏感，屈医生上前询问，初步判断老人患脑中风，立即打车将她送医。经诊断，老人被确诊为脑中风，所幸救治及时，已顺利出院！O老人在公交车上直跺脚，她多看一眼救了一命（视频@大米Video）L央视新闻的微博视频L央视新闻的微博视频,,,大米Video,医生下班路上多看一眼救下一条命,0,0,0,2022-10-10 23:48,微博视频号,,"http://f.video.weibocdn.com/o0/dPEjjUTclx07ZSeh8Jqw01041200pMQ60E010.mp4?label=mp4_720p&template=1280x720.25.0&ori=0&ps=1BVp4ysnknHVZu&Expires=1666621946&ssig=zuJotULEjQ&KID=unistore,video",
4823170013728221,M9IKZfDSB,6612401161,八碗饭不知道吃不吃得饱,访问第一是怒那站确诊怒那病了,,,,,0,0,0,2022-10-10 23:46,iPhone客户端,,,
4823169486030833,M9IK8piTv,5574521688,我就是小许啊,第一次疫情离我这么近，但愿不会有确诊，心慌的不行,,,,,0,0,0,2022-10-10 23:44,iPhone客户端,,,
4823169439632764,M9IK3EpVa,7563656010,元气小豆_,#TF家族三代路演##重庆疫情#明知道重庆有疫情还把小孩丢出去路演现在几例确诊了您高兴了是吧死李飞,,,,"TF家族三代路演,重庆疫情",0,0,2,2022-10-10 23:44,OPPO智能手机,,,
4823169376978348,M9IJXtho0,1703528132,bye88,流动雪糕车#香港疫情#新增确诊487410宗病逝,,,,香港疫情,0,0,0,2022-10-10 23:44,疫情超话,['https://wx4.sinaimg.cn/large/6589c6c4gy1h70mgoqfjqj22c02c0kjl.jpg'],,
4823169309870876,M9IJQFpRG,1711675295,TellengenceSunny,#内蒙古增本土确诊119例无症状559例#天天做核酸，封城中，啥时候能返京哇,,,,内蒙古增本土确诊119例无症状559例,0,0,1,2022-10-10 23:43,Redmi K40,,,
4823169036979271,M9IJpthCT,1897723622,法治四川,法姐讲法【蔡某、邸某等人涉嫌妨害传染病防治罪被公安机关立案侦查】#疫情期间这些行为须承担法律责任##法姐播报#2022年10月9日，我局接高新区卫生健康局关于蔡某（男，38岁，10月9日确诊为新冠肺炎无症状感染者）、高某（女，32岁，10月9日确诊为新冠肺炎阳性患者）、朱某（男，29岁，10月9日检测为新冠肺炎阴性）涉嫌妨害传染病防治案件移交函。经受案调查，现查明：2022年10月6日，四川省疾病预防控制中心发布“对近7日内有新疆维吾尔自治区旅居史的来（返）川人员，自抵川当日起实施7天集中隔离”等相关要求。蔡某一行3人于10月6日从新疆乌鲁木齐自驾出发到蓉。10月7日驾驶途中，蔡某联系四川分公司同事邸某（男，30岁）安排住宿；邸某明知蔡某一行3人来自中高风险区域，无法直接入住酒店，遂安排另一同事张某（男，35岁）一同前往酒店用自己身份证办理好入住登记。10月8日凌晨，邸某将酒店房卡提供给蔡某等3人入住。上述行为违反重点地区来蓉人员隔离管控等规定，未实名登记办理酒店入住手续，隐瞒行程信息（重点地区旅居史），存在引起新型冠状病毒传播的严重危险。蔡某、邸某等人的行为触犯《中华人民共和国刑法》第三百三十条之规定，涉嫌妨害传染病防治罪，我局已依法立案侦查。目前，上述人员均已落实隔离管控措施，该案正在进一步侦办中。警方提示：遵守疫情防控规定，是阻断新型冠状病毒传播的重要举措，也是广大市民应尽的义务。因拒绝执行县级以上人民政府、疾病预防控制机构依照传染病防治法提出的预防、控制措施，造成传染病传播或有传播严重危险，涉嫌违法犯罪的，公安机关将依法严肃追究法律责任。@成都高新公安@四川长安网,,,"成都高新公安,四川长安网","疫情期间这些行为须承担法律责任,法姐播报",3,3,6,2022-10-10 23:42,法姐讲法超话,['https://wx1.sinaimg.cn/large/711cf6e6ly1h70mf6fc6hj20qo12f0xm.jpg'],,
4823168969344205,M9IJiDcQZ,6276509690,-人生最好是小满,确诊趋避模型的认知失调,,,,,0,0,0,2022-10-10 23:42,iPhone客户端,,,
4823168735249129,M9IIVm1xn,5459432196,天地间独一无二的一颗大榴莲,野宫日记这个疫情啊，一会儿确诊了，一会儿风险了，一会儿密接了，一会儿没事了....除了费德勒决赛以外，第一次这么想吃速效救心丸,,,,,1,0,3,2022-10-10 23:41,野宫日记超话,['https://wx1.sinaimg.cn/large/005XtdI0ly1h70mdopv26g306y07kaal.jpg'],,
4823168658966844,M9IINBCGw,5526014601,一隅晚春,y2k男确诊未得肌腱炎,,,,,0,0,1,2022-10-10 23:41,iPhone 13,['https://wx4.sinaimg.cn/large/0061YAPLgy1h70mdd0wb8j30k00k076p.jpg'],,
4823168592643571,M9IIHb5If,5500353330,fox9288,确诊讨好型人格,,,,,0,2,0,2022-10-10 23:41,iPhone客户端,,,
4823168467079461,M9IIutHGR,5866106057,静安jq,吃完晚饭公司被封回不去了就回小区到门口发现好多带肩章的家被偷了果断去超市买东西再进小区最后发现是我这栋楼有确诊的刚大白敲门做核酸这是离疫情最近最近的一次,,,,,0,0,1,2022-10-10 23:40,OPPO Reno4 SE 5G,"['https://wx3.sinaimg.cn/large/006oZA9Ply1h70mcbgf56j32bc334zw5.jpg', 'https://wx2.sinaimg.cn/large/006oZA9Ply1h70mcco9r2j32bc334wsa.jpg', 'https://wx3.sinaimg.cn/large/006oZA9Ply1h70mcdmjwmj32bc334k6f.jpg']",,
4823168282001541,M9IIc8oGV,5915182311,我4泥蝶,为什么要拿疫情和确诊开玩笑你们有病吧,,,,,0,0,0,2022-10-10 23:39,iPhone客户端,,,
4823168160894207,M9II03KCH,3858503195,Monika-d,#内蒙古增本土确诊119例无症状559例#关注一下吧,,,,内蒙古增本土确诊119例无症状559例,0,0,0,2022-10-10 23:39,iPhone客户端,,,
4823168142803558,M9IHYbLkG,6231392220,胥锦里,如果明天确诊急性根尖周炎，那继续活着还有啥意义,,,,,0,0,0,2022-10-10 23:39,OPPO Reno,,,
4823167980012479,M9IHI03fh,1159035347,德德品真亚,#肉球#双双休😷假。这年头，你的邻居你的同学你的同事不是密接，你真是万幸。密接不变确诊，你就中大奖啦！球终于变主力啦，在哥哥的指导帮助下完成的。,,,,肉球,0,1,1,2022-10-10 23:38,HUAWEI Mate 30 Pro,"['https://wx1.sinaimg.cn/large/451579d3ly1h70lxtm49nj20u0190h0m.jpg', 'https://wx3.sinaimg.cn/large/451579d3ly1h70lxtwpzpj20rf140n0k.jpg', 'https://wx3.sinaimg.cn/large/451579d3ly1h70lxue5goj22tc240b29.jpg']",,
